{
    "blend": {
        "func": "add",
        "srcrgb": "srcalpha",
        "dstrgb": "1-srcalpha"
    },
    "vertex": "hollowengine:gltf_entity-1.20.1",
    "fragment": "hollowengine:gltf_entity-1.20.1",
    "attributes": [
        "Position",
        "Color",
        "UV0",
        "UV1",
        "UV2",
        "Normal"
    ],
    "samplers": [
        { "name": "Sampler0" },
        { "name": "Sampler1" },
        { "name": "Sampler2" }
    ],
    "uniforms": [
        { "name": "ModelViewMat", "type": "matrix4x4", "count": 16, "values": [ 1.0, 0.0, 0.0, 0.0, 0.0, 1.0, 0.0, 0.0, 0.0, 0.0, 1.0, 0.0, 0.0, 0.0, 0.0, 1.0 ] },
        { "name": "ProjMat", "type": "matrix4x4", "count": 16, "values": [ 1.0, 0.0, 0.0, 0.0, 0.0, 1.0, 0.0, 0.0, 0.0, 0.0, 1.0, 0.0, 0.0, 0.0, 0.0, 1.0 ] },
        { "name": "IViewRotMat", "type": "matrix3x3", "count": 9, "values": [ 1.0, 0.0, 0.0, 0.0, 1.0, 0.0, 0.0, 0.0, 1.0 ] },
        { "name": "ColorModulator", "type": "float", "count": 4, "values": [ 1.0, 1.0, 1.0, 1.0 ] },
        { "name": "Light0_Direction", "type": "float", "count": 3, "values": [0.0, 0.0, 0.0] },
        { "name": "Light1_Direction", "type": "float", "count": 3, "values": [0.0, 0.0, 0.0] },
        { "name": "FogStart", "type": "float", "count": 1, "values": [ 0.0 ] },
        { "name": "FogEnd", "type": "float", "count": 1, "values": [ 1.0 ] },
        { "name": "FogColor", "type": "float", "count": 4, "values": [ 0.0, 0.0, 0.0, 0.0 ] },
        { "name": "FogShape", "type": "int", "count": 1, "values": [ 0 ] },
        { "name": "NormalMat", "type": "matrix3x3", "count": 9, "values": [ 1.0, 0.0, 0.0, 0.0, 1.0, 0.0, 0.0, 0.0, 1.0 ] }
    ]
}