{
    "blend": {
        "func": "add",
        "srcrgb": "one",
        "dstrgb": "zero"
    },
    "vertex": "boundbyfate-core:darkvision",
    "fragment": "boundbyfate-core:darkvision",
    "attributes": [ "Position" ],
    "samplers": [
        { "name": "DiffuseSampler" }
    ],
    "uniforms": [
        { "name": "ProjMat",               "type": "matrix4x4", "count": 16, "values": [ 1.0, 0.0, 0.0, 0.0, 0.0, 1.0, 0.0, 0.0, 0.0, 0.0, 1.0, 0.0, 0.0, 0.0, 0.0, 1.0 ] },
        { "name": "OutSize",               "type": "float",     "count": 2,  "values": [ 1.0, 1.0 ] },
        { "name": "DarkvisionThreshold",   "type": "float",     "count": 1,  "values": [ 0.4 ] },
        { "name": "DarkvisionStrength",    "type": "float",     "count": 1,  "values": [ 1.0 ] },
        { "name": "DarkvisionBrightness",  "type": "float",     "count": 1,  "values": [ 4.0 ] }
    ]
}
